include/primary-replica.inc
Warnings:
Note	####	Sending passwords in plain text without SSL/TLS is extremely insecure.
Note	####	Storing MySQL user name or password information in the primary info repository is not secure and is therefore not recommended. Please consider using the USER and PASSWORD connection options for START REPLICA; see the 'START REPLICA Syntax' in the MySQL Manual for more information.
[connection primary]
call mtr.add_suppression("Replica I/O: The replica I/O thread stops because a fatal error is encountered when it tried to SET @primary_binlog_checksum");
create table t1(n int);
select * from t1;
n
stop replica sql_thread;
insert into t1 values(1);
insert into t1 values(2);
include/wait_for_replica_param.inc [Read_Primary_Log_Pos]
include/stop_replica.inc
change primary to primary_user='root';
Warnings:
Note	####	Sending passwords in plain text without SSL/TLS is extremely insecure.
Note	####	Storing MySQL user name or password information in the primary info repository is not secure and is therefore not recommended. Please consider using the USER and PASSWORD connection options for START REPLICA; see the 'START REPLICA Syntax' in the MySQL Manual for more information.
start replica;
select * from t1;
n
1
2
drop table t1;
include/rpl_reset.inc
create table t1 (a int);
insert into t1 values (1);
flush logs;
insert into t1 values (2);
include/diff_tables.inc [primary:t1, replica:t1]
include/stop_replica.inc
delete from t1 where a=2;
CHANGE PRIMARY TO relay_log_file='replica-relay-bin.000005', relay_log_pos=4;
start replica sql_thread;
include/wait_for_replica_sql_to_start.inc
include/diff_tables.inc [primary:t1, replica:t1]
start replica io_thread;
include/wait_for_replica_io_to_start.inc
set global relay_log_purge=1;
drop table t1;
include/rpl_reset.inc
Primary_Retry_Count: 
include/stop_replica.inc
CHANGE PRIMARY TO primary_retry_count=20;
include/start_replica.inc
include/stop_replica.inc
CHANGE PRIMARY TO primary_retry_count=0;
include/start_replica.inc
include/stop_replica.inc
CHANGE PRIMARY TO primary_retry_count=1;
include/start_replica.inc
include/stop_replica.inc
CHANGE PRIMARY TO primary_retry_count=10;
include/start_replica.inc
include/stop_replica.inc
CHANGE PRIMARY TO primary_retry_count=RETRY_COUNT_SET;
SELECT RETRY_COUNT_EXPECTED AS current_retry_count;
current_retry_count
RETRY_COUNT_EXPECTED
CHANGE PRIMARY TO primary_connect_retry= 2;
CHANGE PRIMARY TO primary_connect_retry= 1;
include/rpl_restart_server.inc [server_number=2]
include/start_replica.inc
include/stop_replica.inc
CHANGE PRIMARY TO primary_retry_count=10;
CHANGE PRIMARY TO primary_retry_count='a';
ERROR 42000: You have an error in your SQL syntax; check the manual that corresponds to your MySQL server version for the right syntax to use near ''a'' at line 1
CHANGE PRIMARY TO primary_retry_count=-1;
ERROR 42000: You have an error in your SQL syntax; check the manual that corresponds to your MySQL server version for the right syntax to use near '-1' at line 1
include/start_replica.inc
include/stop_replica.inc
CHANGE PRIMARY TO primary_connect_retry= 200, IGNORE_SERVER_IDS= (100, 200, 300, 400, 500);
include/rpl_restart_server.inc [server_number=2]
include/start_replica.inc
Eexpected values: "100, 200, 300, 400, 500" == "100, 200, 300, 400, 500" or 200 == 200
include/stop_replica.inc
CHANGE PRIMARY TO IGNORE_SERVER_IDS= ();
include/start_replica.inc
include/stop_replica.inc
create table t1(n int, b varchar(256));
insert into t1 values(1, <primary_bind>);
change primary to primary_host=<primary_bind>, primary_bind=<primary_bind>;
start replica;
include/wait_for_replica_to_start.inc
drop table t1;
include/stop_replica.inc
create table t1(n int, b varchar(256));
insert into t1 values(1, <primary_bind>);
change primary to  primary_bind=<primary_bind>;
start replica;
include/wait_for_replica_io_error.inc [errno=2003]
got expected error 2003
include/stop_replica.inc
change primary to primary_bind='';
start replica;
include/wait_for_replica_to_start.inc
drop table t1;
include/stop_replica.inc
create table t1(n int, b varchar(256));
insert into t1 values(1, <primary_bind>);
change primary to primary_host=<primary_bind>, primary_bind=<primary_bind>;
start replica;
include/wait_for_replica_to_start.inc
drop table t1;
include/stop_replica.inc
create table t1(n int, b varchar(256));
insert into t1 values(1, <primary_bind>);
change primary to  primary_bind=<primary_bind>;
start replica;
include/wait_for_replica_to_start.inc
drop table t1;
include/stop_replica.inc
CHANGE PRIMARY TO primary_host='SAVE_PRIMARY_HOST';
include/start_replica.inc
include/rpl_end.inc
