include/primary-replica.inc
Warnings:
Note	####	Sending passwords in plain text without SSL/TLS is extremely insecure.
Note	####	Storing MySQL user name or password information in the primary info repository is not secure and is therefore not recommended. Please consider using the USER and PASSWORD connection options for START REPLICA; see the 'START REPLICA Syntax' in the MySQL Manual for more information.
[connection primary]
call mtr.add_suppression("Replica I/O: The replica I/O thread stops because a fatal error is encountered when it tried to SET @primary_binlog_checksum");
create table t1(n int);
select * from t1;
n
stop replica sql_thread;
insert into t1 values(1);
insert into t1 values(2);
include/wait_for_replica_param.inc [Read_Primary_Log_Pos]
include/stop_replica.inc
change primary to primary_user='root';
Warnings:
Note	####	Sending passwords in plain text without SSL/TLS is extremely insecure.
Note	####	Storing MySQL user name or password information in the primary info repository is not secure and is therefore not recommended. Please consider using the USER and PASSWORD connection options for START REPLICA; see the 'START REPLICA Syntax' in the MySQL Manual for more information.
start replica;
select * from t1;
n
1
2
drop table t1;
include/rpl_reset.inc
create table t1 (a int);
insert into t1 values (1);
flush logs;
insert into t1 values (2);
include/diff_tables.inc [primary:t1, replica:t1]
include/stop_replica.inc
delete from t1 where a=2;
CHANGE PRIMARY TO relay_log_file='replica-relay-bin.000005', relay_log_pos=4;
start replica sql_thread;
include/wait_for_replica_sql_to_start.inc
include/diff_tables.inc [primary:t1, replica:t1]
start replica io_thread;
include/wait_for_replica_io_to_start.inc
set global relay_log_purge=1;
drop table t1;
include/rpl_reset.inc
Primary_Retry_Count: 
include/stop_replica.inc
CHANGE PRIMARY TO primary_retry_count=20;
include/start_replica.inc
include/stop_replica.inc
CHANGE PRIMARY TO primary_retry_count=0;
include/start_replica.inc
include/stop_replica.inc
CHANGE PRIMARY TO primary_retry_count=1;
include/start_replica.inc
include/stop_replica.inc
CHANGE PRIMARY TO primary_retry_count=10;
include/start_replica.inc
include/stop_replica.inc
CHANGE PRIMARY TO primary_retry_count=RETRY_COUNT_SET;
SELECT RETRY_COUNT_EXPECTED AS current_retry_count;
current_retry_count
RETRY_COUNT_EXPECTED
CHANGE PRIMARY TO primary_connect_retry= 2;
CHANGE PRIMARY TO primary_connect_retry= 1;
include/rpl_restart_server.inc [server_number=2]
include/start_replica.inc
include/stop_replica.inc
CHANGE PRIMARY TO primary_retry_count=10;
CHANGE PRIMARY TO primary_retry_count='a';
ERROR 42000: You have an error in your SQL syntax; check the manual that corresponds to your MySQL server version for the right syntax to use near ''a'' at line 1
CHANGE PRIMARY TO primary_retry_count=-1;
ERROR 42000: You have an error in your SQL syntax; check the manual that corresponds to your MySQL server version for the right syntax to use near '-1' at line 1
include/start_replica.inc
include/stop_replica.inc
CHANGE PRIMARY TO primary_connect_retry= 200, IGNORE_SERVER_IDS= (100, 200, 300, 400, 500);
include/rpl_restart_server.inc [server_number=2]
include/start_replica.inc
Eexpected values: "100, 200, 300, 400, 500" == "100, 200, 300, 400, 500" or 200 == 200
include/stop_replica.inc
CHANGE PRIMARY TO IGNORE_SERVER_IDS= ();
include/start_replica.inc
include/stop_replica.inc
create table t1(n int, b varchar(256));
insert into t1 values(1, <primary_bind>);
change primary to primary_host=<primary_bind>, primary_bind=<primary_bind>;
start replica;
include/wait_for_replica_to_start.inc
drop table t1;
include/stop_replica.inc
create table t1(n int, b varchar(256));
insert into t1 values(1, <primary_bind>);
change primary to  primary_bind=<primary_bind>;
start replica;
include/wait_for_replica_io_error.inc [errno=2003]
got expected error 2003
include/stop_replica.inc
change primary to primary_bind='';
start replica;
include/wait_for_replica_to_start.inc
drop table t1;
include/stop_replica.inc
create table t1(n int, b varchar(256));
insert into t1 values(1, <primary_bind>);
change primary to primary_host=<primary_bind>, primary_bind=<primary_bind>;
start replica;
include/wait_for_replica_to_start.inc
drop table t1;
include/stop_replica.inc
create table t1(n int, b varchar(256));
insert into t1 values(1, <primary_bind>);
change primary to  primary_bind=<primary_bind>;
start replica;
include/wait_for_replica_to_start.inc
drop table t1;
include/stop_replica.inc
CHANGE PRIMARY TO primary_host='SAVE_PRIMARY_HOST';
include/start_replica.inc
include/rpl_reset.inc
include/stop_replica.inc
CHANGE PRIMARY TO PRIMARY_USER='root', PRIMARY_HOST='', PRIMARY_PORT=PRIMARY_PORT;
ERROR HY000: Incorrect arguments to PRIMARY_HOST
CHANGE PRIMARY TO PRIMARY_USER='root', PRIMARY_HOST='127.0.0.1\n127.0.0.1', PRIMARY_PORT=PRIMARY_PORT;
ERROR HY000: Incorrect argument contains not-allowed LF value: '127.0.0.1
127.0.0.1'
CHANGE PRIMARY TO PRIMARY_USER='root\n', PRIMARY_HOST='primary2.mycompany.com', PRIMARY_PORT=PRIMARY_PORT, PRIMARY_USER='replication', PRIMARY_PASSWORD='bigs3cret', PRIMARY_LOG_FILE='primary2-bin.001', PRIMARY_LOG_POS=4;
ERROR HY000: Incorrect argument contains not-allowed LF value: 'root
'
CHANGE PRIMARY TO PRIMARY_USER='root', PRIMARY_HOST='primary2.mycompany.com', PRIMARY_PORT=PRIMARY_PORT, PRIMARY_USER='repli\ncation', PRIMARY_PASSWORD='bigs3cret', PRIMARY_LOG_FILE='primary2-bin.001', PRIMARY_LOG_POS=4;
ERROR HY000: Incorrect argument contains not-allowed LF value: 'repli
cation'
CHANGE PRIMARY TO PRIMARY_USER='root', PRIMARY_HOST='primary2.mycompany.com', PRIMARY_PORT=PRIMARY_PORT, PRIMARY_USER='replication', PRIMARY_PASSWORD='bigs3cret', PRIMARY_LOG_FILE='primary2-bin.\n001', PRIMARY_LOG_POS=4;
ERROR HY000: Incorrect argument contains not-allowed LF value: 'primary2-bin.
001'
CHANGE PRIMARY TO PRIMARY_USER='root', PRIMARY_HOST='127.0.0.1', PRIMARY_PORT=PRIMARY_PORT;
Warnings:
Note	####	Sending passwords in plain text without SSL/TLS is extremely insecure.
Note	####	Storing MySQL user name or password information in the primary info repository is not secure and is therefore not recommended. Please consider using the USER and PASSWORD connection options for START REPLICA; see the 'START REPLICA Syntax' in the MySQL Manual for more information.
include/start_replica.inc
Warnings:
Warning	3090	Changing sql mode 'NO_AUTO_CREATE_USER' is deprecated. It will be removed in a future release.
Primary_Host = '127.0.0.1'
Warnings:
Warning	3090	Changing sql mode 'NO_AUTO_CREATE_USER' is deprecated. It will be removed in a future release.
include/rpl_reset.inc
include/assert.inc [Password length is 32]
SET SQL_LOG_BIN=0;
GRANT REPLICATION REPLICA ON *.* TO rpl@127.0.0.1 IDENTIFIED BY '012345678901234567890123456789ab';
Warnings:
Warning	1287	Using GRANT for creating new user is deprecated and will be removed in future release. Create new user with CREATE USER statement.
SET SQL_LOG_BIN=1;
include/stop_replica.inc
CHANGE PRIMARY TO PRIMARY_HOST='127.0.0.1', primary_user='rpl', primary_password='012345678901234567890123456789ab';
Warnings:
Note	1759	Sending passwords in plain text without SSL/TLS is extremely insecure.
Note	1760	Storing MySQL user name or password information in the primary info repository is not secure and is therefore not recommended. Please consider using the USER and PASSWORD connection options for START REPLICA; see the 'START REPLICA Syntax' in the MySQL Manual for more information.
include/start_replica_io.inc
include/check_replica_param.inc [Replica_IO_Running]
CHANGE PRIMARY TO PRIMARY_HOST='127.0.0.1', primary_user='rpl', primary_password='x012345678901234567890123456789ab';
ERROR HY000: The password provided for the replication user exceeds the maximum length of 32 characters
SET SQL_LOG_BIN=0;
DROP USER rpl@127.0.0.1;
FLUSH PRIVILEGES;
SET SQL_LOG_BIN=1;
include/stop_replica_io.inc
CHANGE PRIMARY TO PRIMARY_USER = 'root', PRIMARY_PASSWORD = '';
Warnings:
Note	1759	Sending passwords in plain text without SSL/TLS is extremely insecure.
Note	1760	Storing MySQL user name or password information in the primary info repository is not secure and is therefore not recommended. Please consider using the USER and PASSWORD connection options for START REPLICA; see the 'START REPLICA Syntax' in the MySQL Manual for more information.
include/start_replica.inc
include/rpl_end.inc
