include/primary-replica.inc
Warnings:
Note	####	Sending passwords in plain text without SSL/TLS is extremely insecure.
Note	####	Storing MySQL user name or password information in the primary info repository is not secure and is therefore not recommended. Please consider using the USER and PASSWORD connection options for START REPLICA; see the 'START REPLICA Syntax' in the MySQL Manual for more information.
[connection primary]
call mtr.add_suppression("Deadlock found");
**** On Primary ****
CREATE TABLE t1 (a INT PRIMARY KEY, b INT);
INSERT INTO t1 VALUES (1,1), (2,2), (3,3), (4,4);
**** On Replica ****
include/sync_replica_sql_with_primary.inc
SHOW STATUS LIKE 'Replica_retried_transactions';
Variable_name	Value
Replica_retried_transactions	0
set @@global.replica_exec_mode= 'IDEMPOTENT';
UPDATE t1 SET a = 5, b = 47 WHERE a = 1;
SELECT * FROM t1 order by a;
a	b
2	2
3	3
4	4
5	47
**** On Primary ****
UPDATE t1 SET a = 5, b = 5 WHERE a = 1;
SELECT * FROM t1 order by a;
a	b
2	2
3	3
4	4
5	5
**** On Replica ****
include/sync_replica_sql_with_primary.inc
set @@global.replica_exec_mode= default;
SHOW STATUS LIKE 'Replica_retried_transactions';
Variable_name	Value
Replica_retried_transactions	0
SELECT * FROM t1 order by a;
a	b
2	2
3	3
4	4
5	47
include/check_replica_is_running.inc
call mtr.add_suppression("Replica SQL.*Could not execute Update_rows event on table test.t1");
**** On Primary ****
DROP TABLE t1;
include/rpl_end.inc
