include/primary-replica.inc
Warnings:
Note	####	Sending passwords in plain text without SSL/TLS is extremely insecure.
Note	####	Storing MySQL user name or password information in the primary info repository is not secure and is therefore not recommended. Please consider using the USER and PASSWORD connection options for START REPLICA; see the 'START REPLICA Syntax' in the MySQL Manual for more information.
[connection primary]
**** On Primary ****
CREATE TABLE t1 (a INT PRIMARY KEY, b LONG) ENGINE=NDB;
INSERT INTO t1 VALUES (1,1), (2,2);
SELECT * FROM t1 ORDER BY a,b;
a	b
1	1
2	2
**** On Replica ****
INSERT INTO t1 VALUE (3,3);
SELECT * FROM t1 ORDER BY a,b;
a	b
1	1
2	2
3	3
**** On Primary ****
TRUNCATE TABLE t1;
SELECT * FROM t1 ORDER BY a,b;
a	b
**** On Replica ****
SELECT * FROM t1 ORDER BY a,b;
a	b
**** On Primary ****
DROP TABLE t1;
include/show_binlog_events.inc
Log_name	Pos	Event_type	Server_id	End_log_pos	Info
primary-bin.000001	#	Query	#	#	use `test`; CREATE TABLE t1 (a INT PRIMARY KEY, b LONG) ENGINE=NDB
primary-bin.000001	#	Query	#	#	BEGIN
primary-bin.000001	#	Table_map	#	#	table_id: # (test.t1)
primary-bin.000001	#	Table_map	#	#	table_id: # (mysql.ndb_apply_status)
primary-bin.000001	#	Write_rows	#	#	table_id: #
primary-bin.000001	#	Write_rows	#	#	table_id: # flags: STMT_END_F
primary-bin.000001	#	Query	#	#	COMMIT
primary-bin.000001	#	Query	#	#	use `test`; TRUNCATE TABLE t1
primary-bin.000001	#	Query	#	#	use `test`; DROP TABLE `t1` /* generated by server */
**** On Primary ****
CREATE TABLE t1 (a INT PRIMARY KEY, b LONG) ENGINE=NDB;
INSERT INTO t1 VALUES (1,1), (2,2);
SELECT * FROM t1 ORDER BY a,b;
a	b
1	1
2	2
**** On Replica ****
INSERT INTO t1 VALUE (3,3);
SELECT * FROM t1 ORDER BY a,b;
a	b
1	1
2	2
3	3
**** On Primary ****
DELETE FROM t1;
SELECT * FROM t1 ORDER BY a,b;
a	b
**** On Replica ****
SELECT * FROM t1 ORDER BY a,b;
a	b
3	3
**** On Primary ****
DROP TABLE t1;
include/show_binlog_events.inc
Log_name	Pos	Event_type	Server_id	End_log_pos	Info
primary-bin.000001	#	Query	#	#	use `test`; CREATE TABLE t1 (a INT PRIMARY KEY, b LONG) ENGINE=NDB
primary-bin.000001	#	Query	#	#	BEGIN
primary-bin.000001	#	Table_map	#	#	table_id: # (test.t1)
primary-bin.000001	#	Table_map	#	#	table_id: # (mysql.ndb_apply_status)
primary-bin.000001	#	Write_rows	#	#	table_id: #
primary-bin.000001	#	Write_rows	#	#	table_id: # flags: STMT_END_F
primary-bin.000001	#	Query	#	#	COMMIT
primary-bin.000001	#	Query	#	#	use `test`; TRUNCATE TABLE t1
primary-bin.000001	#	Query	#	#	use `test`; DROP TABLE `t1` /* generated by server */
primary-bin.000001	#	Query	#	#	use `test`; CREATE TABLE t1 (a INT PRIMARY KEY, b LONG) ENGINE=NDB
primary-bin.000001	#	Query	#	#	BEGIN
primary-bin.000001	#	Table_map	#	#	table_id: # (test.t1)
primary-bin.000001	#	Table_map	#	#	table_id: # (mysql.ndb_apply_status)
primary-bin.000001	#	Write_rows	#	#	table_id: #
primary-bin.000001	#	Write_rows	#	#	table_id: # flags: STMT_END_F
primary-bin.000001	#	Query	#	#	COMMIT
primary-bin.000001	#	Query	#	#	BEGIN
primary-bin.000001	#	Table_map	#	#	table_id: # (test.t1)
primary-bin.000001	#	Table_map	#	#	table_id: # (mysql.ndb_apply_status)
primary-bin.000001	#	Write_rows	#	#	table_id: #
primary-bin.000001	#	Delete_rows	#	#	table_id: # flags: STMT_END_F
primary-bin.000001	#	Query	#	#	COMMIT
primary-bin.000001	#	Query	#	#	use `test`; DROP TABLE `t1` /* generated by server */
include/rpl_end.inc
